TermID	 Name	 Frequency	 PlotX	 PlotY	 LogSize	 Value	 Uniqueness	 Dispensability	 Representative	 Eliminated
GO:0004674	 protein serine/threonine kinase activity	 1.537	 5.312	 1.235	 2.243	 -2.796	 0.444	 0.000	 -1	 False
GO:0004709	 MAP kinase kinase kinase activity	 0.071	 null	 null	 0.954	 -2.119	 0.454	 0.662	 4674	 True
GO:0004683	 calmodulin-dependent protein kinase activity	 0.079	 null	 null	 1.000	 -1.770	 0.502	 0.668	 4674	 True
GO:0004708	 MAP kinase kinase activity	 0.035	 null	 null	 0.699	 -2.119	 0.478	 0.755	 4674	 True
GO:0032051	 clathrin light chain binding	 0.018	 -3.296	 4.567	 0.477	 -2.721	 0.920	 0.000	 -1	 False
GO:0031434	 mitogen-activated protein kinase kinase binding	 0.018	 -3.105	 -4.586	 0.477	 -2.420	 0.920	 0.129	 -1	 False
GO:0005516	 calmodulin binding	 0.459	 -5.130	 -0.050	 1.724	 -1.315	 0.911	 0.159	 -1	 False
GO:0061631	 ubiquitin conjugating enzyme activity	 0.238	 5.356	 -0.898	 1.447	 -2.119	 0.674	 0.383	 -1	 False
